{
  "schemaVersion": 1,
  "network": "studionet",
  "contractAddress": "0x62188996B24086A062AA550B5A11F5fEa466ea4a",
  "deploymentTransactionHash": "0xae77f00bbe5247e43168270818a5f7cb863c1268bf422e4945d8af01fc50ff31",
  "deployerAddress": "0x21b45103dd05c43969daF3CbB4277391777e2eC7",
  "sourceSha256": "2cded3b2849cbf7808ea91205520a24537895f66e68dc0a5e625e52ff99b510a",
  "deployedAt": "2026-08-24T05:46:22.877Z",
  "classification": "INTENTIONALLY_FROZEN",
  "explorerUrl": "https://genlayer-explorer.vercel.app/tx/0xae77f00bbe5247e43168270818a5f7cb863c1268bf422e4945d8af01fc50ff31",
  "verification": {
    "transactionHash": "0xae77f00bbe5247e43168270818a5f7cb863c1268bf422e4945d8af01fc50ff31",
    "transactionStatus": "FINALIZED",
    "executionResult": "FINISHED_WITH_RETURN",
    "verifiedAt": "2026-08-24T05:51:11.916Z",
    "sourceMatches": true,
    "configReadback": [0, 3, 3, 4, 3, 259200]
  }
}
