{
  "schemaVersion": 1,
  "network": "studionet",
  "contractAddress": "0xf6A3244459E5ACCA088ab41bFcf1eC00bBD54a49",
  "deploymentTransactionHash": "0x5b3354e9906fe6841d9821c40210826bcbc90c0c441a47c232dc8e7f5c542b0e",
  "deployerAddress": "0x21b45103dd05c43969daF3CbB4277391777e2eC7",
  "sourceSha256": "bbb162ccdcf11197e586382896c59b8ee13499582d73e5300b50c45309136ec6",
  "deployedAt": "2026-08-24T05:21:38.547Z",
  "classification": "INTENTIONALLY_FROZEN",
  "explorerUrl": "https://genlayer-explorer.vercel.app/tx/0x5b3354e9906fe6841d9821c40210826bcbc90c0c441a47c232dc8e7f5c542b0e",
  "verification": {
    "transactionHash": "0x5b3354e9906fe6841d9821c40210826bcbc90c0c441a47c232dc8e7f5c542b0e",
    "transactionStatus": "FINALIZED",
    "executionResult": "FINISHED_WITH_RETURN",
    "verifiedAt": "2026-08-24T05:21:38.547Z",
    "sourceMatches": true,
    "configReadback": [0, 3, 3, 4, 3, 259200]
  }
}
